{
  "format": "igmg-lernapp-islam",
  "version": 1,
  "status": "entwurf",
  "kurs": "islam",
  "bereich": "taharah",
  "stufe": "grund",
  "einheit": {
    "schluessel": "islam.grund.e02",
    "reihenfolge": 2,
    "thema": {
      "de": "Nach hanefitischer Lehre – Reinheit II: Die Gebetswaschung (wuḍūʾ)"
    },
    "kannBeschreibungen": [
      {
        "de": "Nach hanefitischer Lehre: Ich kann Anlass, Bedingungen und Pflichtteile der Gebetswaschung nennen."
      },
      {
        "de": "Ich kann Pflichtteile, Sunna-Handlungen, Anstand und Verpöntes bei der Waschung unterscheiden."
      },
      {
        "de": "Ich kann erklären, was die Waschung ungültig macht und was nicht."
      }
    ]
  },
  "lektionen": [
    {
      "schluessel": "islam.grund.e02.l01",
      "titel": "Anlass, Bedingungen und Pflichtteile der Waschung",
      "kinderGeeignet": true,
      "aussagen": [
        {
          "schluessel": "islam.grund.e02.l01.a01",
          "text": "Das Wort ṭahāra bedeutet Sauberkeit; im religiösen Recht ist die Reinheit von Unreinheiten gemeint. Das Wort wuḍūʾ hängt mit „Schönheit“ zusammen. Im religiösen Recht bezeichnet es das Waschen und Bestreichen bestimmter Körperteile, die dadurch schön werden (al-Ikhtiyār).",
          "strittig": false,
          "kinderGeeignet": true,
          "belege": [
            {
              "werk": "ikhtiyar",
              "kapitel": "Kitāb aṭ-Ṭahāra (Begriff und Anlass)",
              "ausgabe": "Maṭbaʿat al-Ḥalabī, Kairo 1356/1937",
              "band": 1,
              "seite": 7,
              "passage": "ikhtiyar.ms0002",
              "fundstelle": "0683IbnMahmudMajdDinMawsili.IkhtiyarLiTaclil.Shamela0001066-ara1#ms2",
              "passageSha256Text": "d65f3e28a91808c61ed70cdbe7cc78a301f8cebc0f19d871068bc0d05405da0b",
              "zitatVon": 1035,
              "zitatBis": 1174,
              "art": "sinngemaess"
            }
          ],
          "quelle": "ki:lernapp-l6-04/claude-opus-5-5/wissen-v1",
          "lizenz": "CC-BY-SA-4.0"
        },
        {
          "schluessel": "islam.grund.e02.l01.a02",
          "text": "Die Gebetswaschung hat vier Pflichtteile (farāʾiḍ): das Gesicht waschen, beide Hände und Arme einschließlich der Ellenbogen waschen, ein Viertel des Kopfes bestreichen (masḥ) und beide Füße einschließlich der Knöchel waschen.",
          "strittig": false,
          "kinderGeeignet": true,
          "belege": [
            {
              "werk": "nur_al_idah",
              "kapitel": "Kitāb aṭ-Ṭahāra › Faṣl fī l-Wuḍūʾ › Farāʾiḍuhu",
              "ausgabe": "Dār al-Ḥikma, 1985",
              "band": 1,
              "seite": 17,
              "passage": "nur_al_idah.ms0003",
              "fundstelle": "1069IbnCammarShurunbulali.NurIdah.JK000284-ara1#ms3",
              "passageSha256Text": "aa42ef555331c267e49597eccfaecae68d03853d2a44bdb6076c9b9ac5377a64",
              "zitatVon": 1574,
              "zitatBis": 1603,
              "art": "sinngemaess"
            },
            {
              "werk": "nur_al_idah",
              "kapitel": "Kitāb aṭ-Ṭahāra › Faṣl fī l-Wuḍūʾ › Farāʾiḍuhu",
              "ausgabe": "Dār al-Ḥikma, 1985",
              "band": 1,
              "seite": 17,
              "passage": "nur_al_idah.ms0004",
              "fundstelle": "1069IbnCammarShurunbulali.NurIdah.JK000284-ara1#ms4",
              "passageSha256Text": "101061d5ff9c9f18a5235a378f9e13d844ff447e71036bc63acb441e36f0163e",
              "zitatVon": 65,
              "zitatBis": 139,
              "art": "sinngemaess"
            },
            {
              "werk": "quduri",
              "kapitel": "Kitāb aṭ-Ṭahāra (Farḍ aṭ-Ṭahāra)",
              "ausgabe": "Dār al-Kutub al-ʿIlmiyya, 1418/1997",
              "band": 1,
              "seite": 11,
              "passage": "quduri.ms0001",
              "fundstelle": "0428AbuHusaynQuduri.Mukhtasar.Sham19Y0124336-ara1#ms1",
              "passageSha256Text": "292eeca259abc987fb54278e58c44d0ba0177c5d197b12938ab55875f9864cf5",
              "zitatVon": 165,
              "zitatBis": 209,
              "art": "sinngemaess"
            },
            {
              "werk": "ikhtiyar",
              "kapitel": "Kitāb aṭ-Ṭahāra › Farāʾiḍ al-Wuḍūʾ",
              "ausgabe": "Maṭbaʿat al-Ḥalabī, Kairo 1356/1937",
              "band": 1,
              "seite": 7,
              "passage": "ikhtiyar.ms0002",
              "fundstelle": "0683IbnMahmudMajdDinMawsili.IkhtiyarLiTaclil.Shamela0001066-ara1#ms2",
              "passageSha256Text": "d65f3e28a91808c61ed70cdbe7cc78a301f8cebc0f19d871068bc0d05405da0b",
              "zitatVon": 1459,
              "zitatBis": 1551,
              "art": "sinngemaess"
            }
          ],
          "verweise": [
            {
              "art": "koran",
              "stelle": "5:6"
            }
          ],
          "quelle": "ki:lernapp-l6-04/claude-opus-5-5/wissen-v1",
          "lizenz": "CC-BY-SA-4.0"
        },
        {
          "schluessel": "islam.grund.e02.l01.a03",
          "text": "Waschen (ghasl) heißt, Wasser über eine Stelle fließen zu lassen. Bestreichen (masḥ) heißt, die Stelle mit Wasser nur zu benetzen.",
          "strittig": false,
          "kinderGeeignet": true,
          "belege": [
            {
              "werk": "hidaya",
              "kapitel": "Kitāb aṭ-Ṭahārāt (Wuḍūʾ)",
              "ausgabe": "al-Maktaba al-Islāmiyya, ohne Jahr (Ausgabe klären, LM-33)",
              "band": 1,
              "seite": 12,
              "passage": "hidaya.ms0001",
              "fundstelle": "0593BurhanDinFarghaniMarghinani.HidayaFiSharhBidaya.JK000242-ara1#ms1",
              "passageSha256Text": "ba4640acfc688c5d16875943ca205b4286052fce775c5828d64818e5e387d0ae",
              "zitatVon": 1531,
              "zitatBis": 1566,
              "art": "sinngemaess"
            },
            {
              "werk": "ikhtiyar",
              "kapitel": "Kitāb aṭ-Ṭahāra (Begriff und Anlass)",
              "ausgabe": "Maṭbaʿat al-Ḥalabī, Kairo 1356/1937",
              "band": 1,
              "seite": 7,
              "passage": "ikhtiyar.ms0002",
              "fundstelle": "0683IbnMahmudMajdDinMawsili.IkhtiyarLiTaclil.Shamela0001066-ara1#ms2",
              "passageSha256Text": "d65f3e28a91808c61ed70cdbe7cc78a301f8cebc0f19d871068bc0d05405da0b",
              "zitatVon": 1245,
              "zitatBis": 1280,
              "art": "sinngemaess"
            }
          ],
          "quelle": "ki:lernapp-l6-04/claude-opus-5-5/wissen-v1",
          "lizenz": "CC-BY-SA-4.0"
        },
        {
          "schluessel": "islam.grund.e02.l01.a04",
          "text": "Zum Gesicht gehört der Länge nach alles vom Haaransatz an der Stirn bis unter das Kinn und der Breite nach alles zwischen den beiden Ohrläppchen. Das Innere der Augen muss nicht gewaschen werden, weil das schwer ist und schaden kann (al-Ikhtiyār).",
          "strittig": false,
          "kinderGeeignet": true,
          "belege": [
            {
              "werk": "nur_al_idah",
              "kapitel": "Kitāb aṭ-Ṭahāra › Faṣl fī l-Wuḍūʾ › Farāʾiḍuhu",
              "ausgabe": "Dār al-Ḥikma, 1985",
              "band": 1,
              "seite": 17,
              "passage": "nur_al_idah.ms0003",
              "fundstelle": "1069IbnCammarShurunbulali.NurIdah.JK000284-ara1#ms3",
              "passageSha256Text": "aa42ef555331c267e49597eccfaecae68d03853d2a44bdb6076c9b9ac5377a64",
              "zitatVon": 1604,
              "zitatBis": 1629,
              "art": "sinngemaess"
            },
            {
              "werk": "nur_al_idah",
              "kapitel": "Kitāb aṭ-Ṭahāra › Faṣl fī l-Wuḍūʾ › Farāʾiḍuhu",
              "ausgabe": "Dār al-Ḥikma, 1985",
              "band": 1,
              "seite": 17,
              "passage": "nur_al_idah.ms0004",
              "fundstelle": "1069IbnCammarShurunbulali.NurIdah.JK000284-ara1#ms4",
              "passageSha256Text": "101061d5ff9c9f18a5235a378f9e13d844ff447e71036bc63acb441e36f0163e",
              "zitatVon": 0,
              "zitatBis": 64,
              "art": "sinngemaess"
            },
            {
              "werk": "hidaya",
              "kapitel": "Kitāb aṭ-Ṭahārāt (Wuḍūʾ)",
              "ausgabe": "al-Maktaba al-Islāmiyya, ohne Jahr (Ausgabe klären, LM-33)",
              "band": 1,
              "seite": 12,
              "passage": "hidaya.ms0001",
              "fundstelle": "0593BurhanDinFarghaniMarghinani.HidayaFiSharhBidaya.JK000242-ara1#ms1",
              "passageSha256Text": "ba4640acfc688c5d16875943ca205b4286052fce775c5828d64818e5e387d0ae",
              "zitatVon": 1567,
              "zitatBis": 1622,
              "art": "sinngemaess"
            },
            {
              "werk": "ikhtiyar",
              "kapitel": "Kitāb aṭ-Ṭahāra › Farāʾiḍ al-Wuḍūʾ",
              "ausgabe": "Maṭbaʿat al-Ḥalabī, Kairo 1356/1937",
              "band": 1,
              "seite": 7,
              "passage": "ikhtiyar.ms0002",
              "fundstelle": "0683IbnMahmudMajdDinMawsili.IkhtiyarLiTaclil.Shamela0001066-ara1#ms2",
              "passageSha256Text": "d65f3e28a91808c61ed70cdbe7cc78a301f8cebc0f19d871068bc0d05405da0b",
              "zitatVon": 1553,
              "zitatBis": 1696,
              "art": "sinngemaess"
            }
          ],
          "quelle": "ki:lernapp-l6-04/claude-opus-5-5/wissen-v1",
          "lizenz": "CC-BY-SA-4.0"
        },
        {
          "schluessel": "islam.grund.e02.l01.a05",
          "text": "Pflicht ist, ein Viertel des Kopfes zu bestreichen. Al-Qudūrī nennt als Pflichtmaß die Fläche der Stirnlocke (nāṣiya); al-Hidāya und al-Ikhtiyār erklären, dass damit ein Viertel des Kopfes gemeint ist.",
          "strittig": false,
          "kinderGeeignet": true,
          "belege": [
            {
              "werk": "nur_al_idah",
              "kapitel": "Kitāb aṭ-Ṭahāra › Faṣl fī l-Wuḍūʾ › Farāʾiḍuhu",
              "ausgabe": "Dār al-Ḥikma, 1985",